{
	"$schema": "../../deployment-tooling/core-upgrade-input.schema.json",
	"apiVersion": "operations.symm.io/core-upgrade-input-v2",
	"kind": "CoreUpgradeInput",
	"name": "arbitrum-vibe-production",
	"network": {
		"name": "arbitrum",
		"chainId": 42161,
		"fork": "fork-arbitrum"
	},
	"release": {
		"ref": "version_0.8.6",
		"baselineRef": "version_0.8.6.2"
	},
	"credentials": {
		"deployer": "hardhat-keystore://TEAM_DEPLOYER",
		"rpc": "hardhat-keystore://RPC_ARBITRUM",
		"explorer": "hardhat-keystore://ETHERSCAN_APIKEY"
	},
	"execution": {
		"confirmations": 1,
		"txTimeoutSeconds": 300,
		"slowNoticeSeconds": 30,
		"verify": true,
		"logLevel": "verbose"
	},
	"governance": {
		"kind": "eoa",
		"owner": "0x77A955776Ee1dd3E9C800c3214ed489441d74b94",
		"signerMode": "ledger",
		"ledgerDerivation": "ledger-live",
		"accountLayerOwner": "0x77A955776Ee1dd3E9C800c3214ed489441d74b94"
	},
	"target": {
		"core": "0x57331027091994FCb9c5Aec48ea92cEf0a93CF6A",
		"collateral": "0xaf88d065e77c8cC2239327C5EDb3A432268e5831",
		"accountLayer": "0x573310d1D6ec18cB21E1aB949414470D9bf5c24E",
		"instantLayer": "0xCB8F789d6f7e59B3D266490e1Aa8e35cFb755132",
		"signatureVerifier": "0x8c8D7561C33f296C958492FF7114e3212968BA03",
		"symbolManager": "0x3FB153ee0a18B2726a54E132C173AC73D8c05e20",
		"gaslessLayer": "0x8347953D80037b8d82827246f37EC7442AD188B4",
		"liquidator": "0xCfB0a84674229500836e662C229530a98bCE11Cc",
		"gaslessReceiver": "0xf023395d052b5247971aAb80791D05A16E6aCed8",
		"partyB": "0x0420b24359d2DCccA53904042aa36A641162445c",
		"multicall": "0xcA11bde05977b3631167028862bE2a173976CA11"
	},
	"limits": {
		"maxQuotes": 10000,
		"maxSymbols": 1000
	},
	"storage": {
		"symbolAdjustment": {
			"legacyAdjustmentWords": 15,
			"upgradedAdjustmentWords": 17,
			"requireEmptyAdjustments": true
		}
	},
	"funding": {
		"aggregate": {
			"repair": true
		}
	},
	"selectors": {
		"core": {
			"allowedRemovals": ["0x9dcdbdda", "0xff363ccc"]
		}
	},
	"roleGrants": [
		{
			"holder": "0x3FB153ee0a18B2726a54E132C173AC73D8c05e20",
			"role": "SYMBOL_LISTING_ROLE"
		},
		{
			"holder": "0x77A955776Ee1dd3E9C800c3214ed489441d74b94",
			"role": "GLOBAL_PAUSER_ROLE"
		},
		{
			"holder": "0x77A955776Ee1dd3E9C800c3214ed489441d74b94",
			"role": "PARTY_A_PAUSER_ROLE"
		},
		{
			"holder": "0x77A955776Ee1dd3E9C800c3214ed489441d74b94",
			"role": "PARTY_B_PAUSER_ROLE"
		},
		{
			"holder": "0x77A955776Ee1dd3E9C800c3214ed489441d74b94",
			"role": "ACCOUNTING_PAUSER_ROLE"
		},
		{
			"holder": "0x77A955776Ee1dd3E9C800c3214ed489441d74b94",
			"role": "INTERNAL_TRANSFER_PAUSER_ROLE"
		},
		{
			"holder": "0x77A955776Ee1dd3E9C800c3214ed489441d74b94",
			"role": "EXTERNAL_TRANSFER_PAUSER_ROLE"
		},
		{
			"holder": "0x77A955776Ee1dd3E9C800c3214ed489441d74b94",
			"role": "LIQUIDATION_PAUSER_ROLE"
		},
		{
			"holder": "0x77A955776Ee1dd3E9C800c3214ed489441d74b94",
			"role": "INSTANT_LAYER_PAUSER_ROLE"
		},
		{
			"holder": "0x77A955776Ee1dd3E9C800c3214ed489441d74b94",
			"role": "WITHDRAW_ADVANCE_PAUSER_ROLE"
		}
	],
	"inventory": {
		"expressProvider": {
			"kind": "contract",
			"address": "0x5733105ab392829E5e20FA1eF6E6e07A2c7E073A"
		},
		"feesManager": {
			"kind": "contract",
			"address": "0xc9B7E07E2Fce4FbFbf59D7d06b41Dc5e2Bd495e1"
		},
		"create2Factory": {
			"kind": "contract",
			"address": "0x99B425BC19F99a1B922664c0E4fa8A0870CE9975"
		},
		"affiliate": {
			"kind": "contract",
			"address": "0x58bB5Bdc279321507DfB7AB54B9e7EF3DdA6E24D"
		},
		"rfl": {
			"kind": "contract",
			"address": "0x8C98c60116513D6F6C060450483a1ff44ec1c94b"
		},
		"vibeHook": {
			"kind": "contract",
			"address": "0xb08e1F492597901626CF363140b2057DA6A758ca"
		},
		"rakeback": {
			"kind": "contract",
			"address": "0x08CB9B122524B31f5220099042A31393B862063c"
		},
		"vibeRakebackHook": {
			"kind": "contract",
			"address": "0xcEF3Ec6c81c1a1119f3a8E537Cf9D26fd9Ff14f3"
		},
		"analytics": {
			"kind": "subgraph",
			"url": "https://api.goldsky.com/api/public/project_cm1hfr4527p0f01u85mz499u8/subgraphs/arbitrum-vibe-mainnet-analytics/latest/gn"
		},
		"events": {
			"kind": "subgraph",
			"url": "https://api.goldsky.com/api/public/project_cm1hfr4527p0f01u85mz499u8/subgraphs/arbitrum-vibe-mainnet-events/stage/gn"
		},
		"possibleFeeCollector": {
			"kind": "account",
			"address": "0xd4a61e8D4adD3382AFDCaC87ec4c98c6a6102B73"
		}
	}
}
